{
  "schema_version": "gridz/1.0.0",
  "subject": {
    "type": "agent",
    "did": "did:key:z6Mkv48a8DBwH6EPm4oUDKsAMt24Uj246AjLkh2nVyhmUfT3"
  },
  "theme": {
    "background_type": "solid",
    "background_value": "#0b0b0f",
    "accent_color": "#7c5cff",
    "text_color": "#f4f4f5",
    "card_style": "rounded",
    "card_background": "#16161c",
    "font_family": "sans",
    "show_gridz_badge": true
  },
  "cells": [
    {
      "id": "a1",
      "key": "agent-context",
      "value": "example agent context",
      "position": {
        "x": 0,
        "y": 0,
        "w": 1,
        "h": 1
      },
      "size": "1x1",
      "is_visible": true,
      "attestation": {
        "attester": "did:key:z6Mkv48a8DBwH6EPm4oUDKsAMt24Uj246AjLkh2nVyhmUfT3",
        "iat": "2026-01-01T00:00:00.000Z",
        "value_hash": "0x6f0f9a3a2538fb5b06f70253af894fd5092152bc01253474b8df805b9c46117c",
        "format": "jws-ed25519",
        "uid": "0xd7690f9e4d0e8c24089be8fc43b4a523ac3cb7d25ebf37f8685824a56ce90e6d",
        "uri": "data://inline/0xd7690f9e4d0e8c24089be8fc43b4a523ac3cb7d25ebf37f8685824a56ce90e6d",
        "payload": "eyJraW5kIjoiandzIiwiandzIjoiZXlKaGJHY2lPaUpGWkVSVFFTSXNJblI1Y0NJNklrcFhWQ0lzSW10cFpDSTZJbVJwWkRwclpYazZlalpOYTNZME9HRTRSRUozU0RaRlVHMDBiMVZFUzNOQlRYUXlORlZxTWpRMlFXcE1hMmd5YmxaNWFHMVZabFF6SW4wLmV5SnBjM01pT2lKa2FXUTZhMlY1T25vMlRXdDJORGhoT0VSQ2QwZzJSVkJ0Tkc5VlJFdHpRVTEwTWpSVmFqSTBOa0ZxVEd0b01tNVdlV2h0VldaVU15SXNJbWR5YVdSSlpDSTZJakI0TkRNNVkyUmxZVE5tTVRrelpHRTNOV05tWXpSaVlURTFaalF6TldWaU5qWmpORFE1TnpWak1qWTNaV0k1TURBek9UYzRObVEyWkRFeVlqQmxZMk0wTnlJc0ltdGxlU0k2SW1GblpXNTBMV052Ym5SbGVIUWlMQ0oyWVd4MVpVaGhjMmhJWlhnaU9pSXdlRFptTUdZNVlUTmhNalV6T0daaU5XSXdObVkzTURJMU0yRm1PRGswWm1RMU1Ea3lNVFV5WW1Nd01USTFNelEzTkdJNFpHWTRNRFZpT1dNME5qRXhOMk1pTENKM2FXUm5aWFJVZVhCbFNHRnphQ0k2SWpCNFpUTmlNR00wTkRJNU9HWmpNV014TkRsaFptSm1OR000T1RrMlptSTVNalF5TjJGbE5ERmxORFkwT1dJNU16UmpZVFE1TlRrNU1XSTNPRFV5WWpnMU5TSXNJbVY0Y0dseVpYTkJkQ0k2TUN3aWJtOXVZMlVpT2lJd0lpd2lhV0YwSWpveE56WTNNakkxTmpBd2ZRLjc1Ykh5c2h5dWZEZkNsUWVpV2ZDN193WXR3M3hIWmxvUGdkamJLa3ZRY1psVVo1Q2N3V08tWDgxWmMxeEwzY3dYUENmVlc0bjdJTXo0RnQ1UjFfeEJBIn0"
      }
    }
  ],
  "root_attestation": {
    "attester": "did:key:z6Mkv48a8DBwH6EPm4oUDKsAMt24Uj246AjLkh2nVyhmUfT3",
    "iat": "2026-01-01T00:00:00.000Z",
    "value_hash": "0xd7690f9e4d0e8c24089be8fc43b4a523ac3cb7d25ebf37f8685824a56ce90e6d",
    "format": "jws-ed25519",
    "uid": "0x1c26b333846f2294375c4d31bb65f126e7e001b614b238687277fe91bc4ad87a",
    "uri": "data://inline/0x1c26b333846f2294375c4d31bb65f126e7e001b614b238687277fe91bc4ad87a",
    "payload": "eyJraW5kIjoiandzIiwiandzIjoiZXlKaGJHY2lPaUpGWkVSVFFTSXNJblI1Y0NJNklrcFhWQ0lzSW10cFpDSTZJbVJwWkRwclpYazZlalpOYTNZME9HRTRSRUozU0RaRlVHMDBiMVZFUzNOQlRYUXlORlZxTWpRMlFXcE1hMmd5YmxaNWFHMVZabFF6SW4wLmV5SnBjM01pT2lKa2FXUTZhMlY1T25vMlRXdDJORGhoT0VSQ2QwZzJSVkJ0Tkc5VlJFdHpRVTEwTWpSVmFqSTBOa0ZxVEd0b01tNVdlV2h0VldaVU15SXNJbWR5YVdSSlpDSTZJakI0TkRNNVkyUmxZVE5tTVRrelpHRTNOV05tWXpSaVlURTFaalF6TldWaU5qWmpORFE1TnpWak1qWTNaV0k1TURBek9UYzRObVEyWkRFeVlqQmxZMk0wTnlJc0ltMWxjbXRzWlZKdmIzUWlPaUl3ZUdRM05qa3daamxsTkdRd1pUaGpNalF3T0RsaVpUaG1ZelF6WWpSaE5USXpZV016WTJJM1pESTFaV0ptTXpkbU9EWTROVGd5TkdFMU5tTmxPVEJsTm1RaUxDSnpZMmhsYldGV1pYSnphVzl1SWpvaVozSnBaSG92TVM0d0xqQWlMQ0pqWld4c1EyOTFiblFpT2pFc0ltbGhkQ0k2TVRjMk56SXlOVFl3TUgwLnB5eEdfTkF6Z2hDRDFwMjB2dm9zMjFpNGZpa3M1azB1ZUhPU085SUVWVVB1TmdrWTBFM3duOTI5MGNfdDBXUm9Md0dfT0FlT0VfYXRHOUpSbEVGeEJRIn0"
  }
}
